{
  "_args": [
    [
      {
        "raw": "/private/var/folders/dc/08bztltx53v8vk2hf180zqxw0000gn/T/d-118310-7184-1446wgk.ff8uth85mi/package.tgz",
        "scope": null,
        "escapedName": null,
        "name": null,
        "rawSpec": "/private/var/folders/dc/08bztltx53v8vk2hf180zqxw0000gn/T/d-118310-7184-1446wgk.ff8uth85mi/package.tgz",
        "spec": "/private/var/folders/dc/08bztltx53v8vk2hf180zqxw0000gn/T/d-118310-7184-1446wgk.ff8uth85mi/package.tgz",
        "type": "local"
      },
      "/private/var/folders/dc/08bztltx53v8vk2hf180zqxw0000gn/T/apm-install-dir-118310-7184-gcdth8.2rqhsbrzfr"
    ]
  ],
  "_from": "../d-118310-7184-1446wgk.ff8uth85mi/package.tgz",
  "_id": "base16-syntax@1.8.1",
  "_inCache": true,
  "_location": "/base16-syntax",
  "_phantomChildren": {},
  "_requested": {
    "raw": "/private/var/folders/dc/08bztltx53v8vk2hf180zqxw0000gn/T/d-118310-7184-1446wgk.ff8uth85mi/package.tgz",
    "scope": null,
    "escapedName": null,
    "name": null,
    "rawSpec": "/private/var/folders/dc/08bztltx53v8vk2hf180zqxw0000gn/T/d-118310-7184-1446wgk.ff8uth85mi/package.tgz",
    "spec": "/private/var/folders/dc/08bztltx53v8vk2hf180zqxw0000gn/T/d-118310-7184-1446wgk.ff8uth85mi/package.tgz",
    "type": "local"
  },
  "_requiredBy": [
    "#USER"
  ],
  "_resolved": "file:../d-118310-7184-1446wgk.ff8uth85mi/package.tgz",
  "_shasum": "a960eb0cb3014c0b65191ff8e6edd46d57e4ae44",
  "_shrinkwrap": null,
  "_spec": "/private/var/folders/dc/08bztltx53v8vk2hf180zqxw0000gn/T/d-118310-7184-1446wgk.ff8uth85mi/package.tgz",
  "_where": "/private/var/folders/dc/08bztltx53v8vk2hf180zqxw0000gn/T/apm-install-dir-118310-7184-gcdth8.2rqhsbrzfr",
  "bugs": {
    "url": "https://github.com/alchiadus/base16-syntax/issues"
  },
  "dependencies": {
    "atom-space-pen-views": "^2.0.0"
  },
  "description": "A Base16 syntax theme with support for all Base16 color schemes and styles.",
  "devDependencies": {},
  "engines": {
    "atom": ">=1.13.0 <2.0.0"
  },
  "homepage": "https://github.com/alchiadus/base16-syntax#readme",
  "keywords": [
    "base16",
    "eighties",
    "monokai",
    "solarized",
    "tomorrow",
    "3024",
    "apathy",
    "ashes",
    "atelier cave",
    "atelier dune",
    "atelier estuary",
    "atelier forest",
    "atelier heath",
    "atelier lakeside",
    "atelier plateau",
    "atelier savanna",
    "atelier seaside",
    "atelier sulphurpool",
    "bespin",
    "brewer",
    "bright",
    "chalk",
    "codeschool",
    "colors",
    "darktooth",
    "default",
    "embers",
    "flat",
    "github",
    "google",
    "grayscale",
    "greenscreen",
    "harmonic",
    "hopscotch",
    "irblack",
    "isotope",
    "macintosh",
    "marrakesh",
    "materia",
    "mocha",
    "ocean",
    "oceanicnext",
    "onedark",
    "paraiso",
    "phd",
    "pico",
    "pop",
    "railscasts",
    "seti",
    "shapeshifter",
    "solarflare",
    "spacemacs",
    "summerfruit",
    "tube",
    "twilight",
    "unikitty",
    "yesterday bright",
    "yesterday night",
    "yesterday"
  ],
  "license": "MIT",
  "main": "./lib/base16",
  "name": "base16-syntax",
  "optionalDependencies": {},
  "readme": "Base16 Syntax Theme\n====================\n\nA Base16 syntax theme with support for all Base16 color schemes and styles.\n\n![Base16 Syntax Preview](https://raw.githubusercontent.com/Alchiadus/base16-syntax/master/preview.gif)\n\nThe following Base16 color schemes are included:\n- 3024\n- Apathy\n- Ashes\n- Atelier Cave\n- Atelier Dune\n- Atelier Estuary\n- Atelier Forest\n- Atelier Heath\n- Atelier Lakeside\n- Atelier Plateau\n- Atelier Savanna\n- Atelier Seaside\n- Atelier Sulphurpool\n- Bespin\n- Brewer\n- Bright\n- Chalk\n- Codeschool\n- Colors\n- Darktooth\n- Default\n- Eighties\n- Embers\n- Flat\n- GitHub\n- Google\n- Grayscale\n- Greenscreen\n- Harmonic\n- Hopscotch\n- Irblack\n- Isotope\n- Macintosh\n- Marrakesh\n- Materia\n- Mocha\n- Monokai\n- Ocean\n- OceanicNext\n- OneDark\n- Paraiso\n- PhD\n- Pico\n- Pop\n- Railscasts\n- Seti\n- Shapeshifter\n- Solarflare\n- Solarized\n- Spacemacs\n- Summerfruit\n- Tomorrow\n- Tube\n- Twilight\n- Unikitty\n- Yesterday Bright\n- Yesterday Night\n- Yesterday\n\nEach color scheme comes in a dark and light style.\n\n## Install Base16 Syntax\n\nBase16 Syntax can be installed by going to the _Settings_ view (<kbd>Ctrl + ,</kbd>). Select the _Install_ section on the left, hit the _Themes_ button and search for `Base16` in the search box. Click on _Install_ on the Base16 Syntax card.\n\nAlternatively, open a terminal and type in:\n\n```\napm install base16-syntax\n```\n\n## Enable Base16 Syntax\n\nBase16 Syntax can be enabled by going to the _Settings_ view (<kbd>Ctrl + ,</kbd>). Select the _Themes_ section on the left side and choose _Base16_ from the _Syntax Theme_ drop down menu.\n\n## Change the default theme\n\nThe `Default (Light)` syntax theme is loaded when using a light UI theme and the `Default (Dark)` syntax theme is loaded when using a dark UI theme or when a dark or light UI theme could not be detected.\n\nThe theme can be changed by choosing a different `scheme` or `style` from the drop down menu in the `Base16 Syntax` _Settings_ view.\n\nAlternatively, the theme can be changed in the Preview Mode. Toggle the _Command Palette_ (<kbd>Ctrl + Shift + P</kbd>). Type in `Base16 Syntax: Select Theme` and choose another theme from the list. While browsing through the list of available themes a live preview of each selected theme is automatically applied to all open files.\n\nNote: by default, only the styles matching the UI theme are shown in the Preview Mode, i.e. only dark styles are shown when using a dark UI theme and only light styles are shown when using a light UI theme. This can be disabled by going to the `Base16 Syntax` _Settings_ view and uncheck `Match User Interface Theme`.\n\n## Credits\n\nThe original [Base16 Theme](https://github.com/chriskempson/base16) is made by [Chris Kempson](http://chriskempson.com).\n",
  "readmeFilename": "README.md",
  "repository": {
    "type": "git",
    "url": "git+https://github.com/alchiadus/base16-syntax.git"
  },
  "theme": "syntax",
  "version": "1.8.1"
}
